{
  "assignments": [
    {
      "assignmentId": "8c4d0f0fb1b3068764e476c4",
      "authorizationSha256": "4f2a24c7b6a0bdf46e9d83a41ec27eae605016c12a451b109b26ee97ed5fdfc0",
      "holderExecutionId": "MIB_ROLE6_FIRST_ASSIGNMENT_HOLDER_20260804_1802_6BB3D2454E65D0254CD93ED7",
      "operationId": "METHODS_FORMAL_RECORD_TYPE_DEPENDENCY_THREE_ANCHOR_AND_DEVELOPMENTAL_BASELINE_AUDIT_v1",
      "operationPacketSha256": "5c93a8ebe638b9f06a4e14fc42f8ee202c8801e940527aa4fb987006a04e0cdc",
      "packetSuccessorHead": "fa7e74403ff43e017bccef7462f4e001918cf0a3",
      "predecessorLedgerHead": "38278be08265e21387e163a902f6f715c15ae91361f383418cf0c4eba86e31a0",
      "returnDestination": "METHODS_INFORMATION_BENCHMARK_GOVERNANCE_INTAKE",
      "returnRequired": true,
      "roleId": "ROLE_6_REQUIREMENTS_AND_CAUSAL_AUTHORITY",
      "status": "ACTIVE",
      "terminationLaw": {
        "postTerminationRoleState": "INACTIVE",
        "residualGeneralRoleAuthorityAllowed": false,
        "terminatesAtFirstOf": [
          "ACCEPTED_MACHINE_READABLE_RETURN",
          "DECLARED_STOPPING_BOUNDARY",
          "PACKET_DEFINED_OPERATION_EXPIRY",
          "FAIL_CLOSED_AUTHORITY_OR_SCOPE_VIOLATION",
          "USER_REVOCATION"
        ]
      }
    }
  ],
  "bootstrapFingerprint": "86597f327a3ad0b49a1f4580ed25f07a8032197f470490bcd060ed15d6e2cb54",
  "genesisCandidateHead": "3c303a49b4e90cf8672cd76f9f2c31041c2e56d1",
  "ledgerHead": "c351db89434f9a65a28cbacbd0122c0396b15f12b5e6d529b09dbdfa9bf120a3",
  "revision": 1,
  "schema": "METHODS_INFORMATION_BENCHMARK_FIRST_ASSIGNMENT_LEDGER_v1"
}
